{"schema_version":"1.0","scenario_id":"f01-leader-termination-repaired","pair_id":"F01","variant":"repaired","seed":101,"cluster":{"nodes":["n1","n2","n3","n4"],"initial_voters":["n1","n2","n3"],"joint_voters":[]},"timing":{"heartbeat_interval_ticks":2,"election_timeout_ticks":{"n1":5,"n2":7,"n3":9,"n4":11},"clock_offsets_ms":{"n1":4,"n2":-4,"n3":1,"n4":0},"clock_drift_ppm":25},"initial_state":{"hard_state":{"n1":{"current_term":0,"voted_for":null,"commit_index":0,"last_applied":0},"n2":{"current_term":0,"voted_for":null,"commit_index":0,"last_applied":0},"n3":{"current_term":0,"voted_for":null,"commit_index":0,"last_applied":0},"n4":{"current_term":0,"voted_for":null,"commit_index":0,"last_applied":0}},"logs":{"n1":[],"n2":[],"n3":[],"n4":[]},"snapshots":{"n1":{"last_included_index":0,"last_included_term":0,"checksum":"genesis"},"n2":{"last_included_index":0,"last_included_term":0,"checksum":"genesis"},"n3":{"last_included_index":0,"last_included_term":0,"checksum":"genesis"},"n4":{"last_included_index":0,"last_included_term":0,"checksum":"genesis"}},"client_sessions":{},"key_values":{"exposures":0},"max_fence":40},"events":[{"tick":1,"type":"elect"},{"tick":7,"type":"terminate_leader"}],"controls":{"persist_before_response":true,"commit_before_reply":true,"require_majority":true,"deduplicate_clients":true,"read_barrier":true,"atomic_snapshot":true,"joint_consensus":true,"enforce_fencing":true,"validate_prev_log":true},"expected":{"target_invariant":"C05","repaired_invariants":["C01","C02","C03","C04","C05","C06","C07","C08","C09","C10"]}}
